{
  "record_format": "determa.public_host_compatibility_change",
  "record_schema_version": 1,
  "issue": "104",
  "old_protocol_fingerprint": "sha256:b844d89c472954876ba54ff38511aeb9bfaa0c0bbf7546f3d35a089568315fe8",
  "proposed_protocol_fingerprint": "sha256:b844d89c472954876ba54ff38511aeb9bfaa0c0bbf7546f3d35a089568315fe8",
  "manifest_fingerprint": "sha256:4c5f82adb4c4bc33ffcda3ae21c8f47937210c731708f8d2882a5305ef822b12",
  "affected_capabilities": [
    "source_ordered"
  ],
  "cross_language_fixture_matrix": [
    {
      "consumer": "Python embedded client",
      "positive": "vectors/extensions/capability-cases-v1.json#configured_transport_source_order_satisfied",
      "negative": "vectors/extensions/capability-cases-v1.json#unknown_transport_capability",
      "rule": "Exact descriptor/report/requirement schema checks and production common negotiation with independently verified premises; public source_ordered advertisement additionally requires actual configured source-order operational proof."
    },
    {
      "consumer": "Rust embedded client",
      "positive": "vectors/extensions/capability-cases-v1.json#configured_transport_source_order_satisfied",
      "negative": "vectors/extensions/capability-cases-v1.json#unknown_transport_capability",
      "rule": "Exact descriptor/report/requirement schema checks and production common negotiation with independently verified premises; public source_ordered advertisement additionally requires actual configured source-order operational proof."
    },
    {
      "consumer": "local reference host",
      "positive": "vectors/extensions/capability-cases-v1.json#configured_transport_source_order_satisfied",
      "negative": "vectors/extensions/capability-cases-v1.json#unknown_transport_capability",
      "rule": "Exact descriptor/report/requirement schema checks and production common negotiation with independently verified premises; public source_ordered advertisement additionally requires actual configured source-order operational proof."
    },
    {
      "consumer": "future hosted service",
      "positive": "vectors/extensions/capability-cases-v1.json#configured_transport_source_order_satisfied",
      "negative": "vectors/extensions/capability-cases-v1.json#unknown_transport_capability",
      "rule": "Exact descriptor/report/requirement schema checks and production common negotiation with independently verified premises; public source_ordered advertisement additionally requires actual configured source-order operational proof."
    }
  ]
}
