{
  "record_format": "determa.public_host_compatibility_change",
  "record_schema_version": 1,
  "issue": "110",
  "old_protocol_fingerprint": "sha256:b844d89c472954876ba54ff38511aeb9bfaa0c0bbf7546f3d35a089568315fe8",
  "proposed_protocol_fingerprint": "sha256:b844d89c472954876ba54ff38511aeb9bfaa0c0bbf7546f3d35a089568315fe8",
  "manifest_fingerprint": "sha256:4c5f82adb4c4bc33ffcda3ae21c8f47937210c731708f8d2882a5305ef822b12",
  "affected_capabilities": [
    "native_actions",
    "emission_identity",
    "runtime_provider_resolution"
  ],
  "cross_language_fixture_matrix": [
    {
      "consumer": "Python embedded client",
      "positive": "vectors/providers/multiple-send-action-output.json; vectors/providers/multiple-send-identities.json; vectors/providers/inert-provider-metadata.yaml",
      "negative": "vectors/providers/invalid-multiple-send-identities.json; vectors/providers/invalid-action-output.json",
      "rule": "Check distinct exact IDs and continuing action-local internal/external ordinals at the native containing slot pointer; preserve both intents through checkpoint commit/replay. Refuse duplicate derived IDs and unsupported proposals. Provider-like keys in inert metadata/values never require installation."
    },
    {
      "consumer": "Rust embedded client",
      "positive": "vectors/providers/multiple-send-action-output.json; vectors/providers/multiple-send-identities.json; vectors/providers/inert-provider-metadata.yaml",
      "negative": "vectors/providers/invalid-multiple-send-identities.json; vectors/providers/invalid-action-output.json",
      "rule": "Check distinct exact IDs and continuing action-local internal/external ordinals at the native containing slot pointer; preserve both intents through checkpoint commit/replay. Refuse duplicate derived IDs and unsupported proposals. Provider-like keys in inert metadata/values never require installation."
    },
    {
      "consumer": "local reference host",
      "positive": "vectors/providers/multiple-send-action-output.json; vectors/providers/multiple-send-identities.json; vectors/providers/inert-provider-metadata.yaml",
      "negative": "vectors/providers/invalid-multiple-send-identities.json; vectors/providers/invalid-action-output.json",
      "rule": "Check distinct exact IDs and continuing action-local internal/external ordinals at the native containing slot pointer; preserve both intents through checkpoint commit/replay. Refuse duplicate derived IDs and unsupported proposals. Provider-like keys in inert metadata/values never require installation."
    },
    {
      "consumer": "future hosted service",
      "positive": "vectors/providers/multiple-send-action-output.json; vectors/providers/multiple-send-identities.json; vectors/providers/inert-provider-metadata.yaml",
      "negative": "vectors/providers/invalid-multiple-send-identities.json; vectors/providers/invalid-action-output.json",
      "rule": "Check distinct exact IDs and continuing action-local internal/external ordinals at the native containing slot pointer; preserve both intents through checkpoint commit/replay. Refuse duplicate derived IDs and unsupported proposals. Provider-like keys in inert metadata/values never require installation."
    }
  ]
}
